{
  "schema_kind": "loupe-interaction-scenario",
  "schema_version": 1,
  "scenario_id": "hover-sparse",
  "description": "Pointer sweeps left to right across a page holding three findings. Establishes the sparse-page candidate-count and latency baseline that hover-dense is compared against.",
  "fixture": {
    "page_count": 4,
    "page_size_mm": {
      "width": 210.0,
      "height": 297.0
    },
    "pixel_per_mm": 2.0,
    "device_pixel_ratio": 1.0,
    "initial_zoom": 1.0,
    "viewport_size_px": {
      "width": 1200,
      "height": 800
    },
    "page_layout": "single-page",
    "hit_targets": [
      {
        "kind": "finding",
        "page_index": 0,
        "id": "f-0001",
        "page_bounds": {
          "x": 20.0,
          "y": 20.0,
          "width": 40.0,
          "height": 20.0
        }
      },
      {
        "kind": "finding",
        "page_index": 0,
        "id": "f-0002",
        "page_bounds": {
          "x": 90.0,
          "y": 20.0,
          "width": 30.0,
          "height": 30.0
        }
      },
      {
        "kind": "finding",
        "page_index": 0,
        "id": "f-0003",
        "page_bounds": {
          "x": 20.0,
          "y": 80.0,
          "width": 60.0,
          "height": 15.0
        }
      }
    ]
  },
  "cost_model": {
    "base_frame_ns": 500000,
    "hit_test_ns_per_candidate": 20000,
    "overlay_ns_per_primitive": 3000,
    "page_surface_admit_ns": 400000,
    "cache_miss_ns": 2000000,
    "external_present_ns": 1500000
  },
  "budgets": {
    "refresh_rate_hz": 60.0,
    "frame_p95_ms": 16.667,
    "input_to_frame_p95_ms": 16.667,
    "max_slow_frames": 0,
    "max_dropped_frames": 0,
    "variance_band_multiplier": 2.5
  },
  "expected": {
    "hover_id": "",
    "selected_id": "",
    "drag_completed": 0,
    "request_generation_changed": false,
    "cancellations": [],
    "unbalanced_frames": 0,
    "pending_inputs": 0
  },
  "input_script": [
    {
      "kind": "hover-sweep",
      "at_px": {
        "x": 40,
        "y": 60
      },
      "to_px": {
        "x": 700,
        "y": 60
      },
      "steps": 120,
      "interval_ns": 16666667
    }
  ]
}
